{
  "$schema": "https://json-schema.org/draft/2020-12/schema",
  "$id": "https://forme.sh/schema/card.schema.json",
  "title": "Forme Decision Card",
  "description": "One proposal for the user to accept / park / reject. Envelope-shaped (origin/from/role) so a card can later be relayed between Forme nodes. Produced by a read-only agent; written to disk deterministically by Forme code.",
  "type": "object",
  "additionalProperties": false,
  "required": [
    "schemaVersion",
    "id",
    "origin",
    "from",
    "role",
    "category",
    "title",
    "evidence",
    "diff",
    "options",
    "fingerprint",
    "createdAt"
  ],
  "properties": {
    "schemaVersion": {
      "description": "Card schema major version. Bumped on breaking changes.",
      "const": "0"
    },
    "id": {
      "description": "Unique id of this card instance (not stable across regenerations; see fingerprint for identity).",
      "type": "string",
      "minLength": 1
    },
    "origin": {
      "description": "Envelope: the substrate + agent run that produced the content.",
      "type": "object",
      "additionalProperties": false,
      "required": ["agent", "runId", "at"],
      "properties": {
        "agent": {
          "description": "Executing substrate/agent, e.g. 'codex', 'opencode', 'claude-code'.",
          "type": "string",
          "minLength": 1
        },
        "model": {
          "description": "Optional model identifier used for the run.",
          "type": "string"
        },
        "runId": {
          "description": "Runner invocation id that produced this card.",
          "type": "string",
          "minLength": 1
        },
        "at": {
          "description": "When the producing run started.",
          "type": "string",
          "format": "date-time"
        },
        "host": {
          "description": "Optional producing host identifier.",
          "type": "string"
        }
      }
    },
    "from": {
      "description": "Envelope: identity of the Forme node that emitted this card. Reserved for post-MVP agent relay; MVP is always the local node.",
      "type": "string",
      "minLength": 1
    },
    "role": {
      "description": "Envelope: message role in the relay protocol. v0 cards are always 'proposal'. Reserved future values: 'digest' (State Diff), 'decision', 'relay', 'ack'.",
      "type": "string",
      "enum": ["proposal"]
    },
    "category": {
      "description": "Drift category slug. Part of the dedup fingerprint. kebab-case, e.g. 'stale-frontmatter', 'broken-link', 'stale-claim', 'orphan'.",
      "type": "string",
      "pattern": "^[a-z0-9]+(-[a-z0-9]+)*$"
    },
    "title": {
      "description": "Human headline of the card (Chinese by default). The one thing the user reads first.",
      "type": "string",
      "minLength": 1
    },
    "summary": {
      "description": "Optional single-line context beneath the title.",
      "type": "string"
    },
    "evidence": {
      "description": "Why this card exists. Every claim in the title must be grounded here. Rendered as the 证据 block.",
      "type": "array",
      "minItems": 1,
      "items": { "$ref": "#/$defs/evidenceItem" }
    },
    "diff": {
      "description": "The single minimal change proposed. Applied deterministically by Forme code (git-committed for rollback), and rendered as -/+.",
      "$ref": "#/$defs/diff"
    },
    "options": {
      "description": "Decision gestures. MVP is always accept / park / reject.",
      "type": "array",
      "minItems": 3,
      "items": { "$ref": "#/$defs/option" }
    },
    "fingerprint": {
      "description": "Deterministic dedup key = sha256(category \\u0000 diff.file \\u0000 diffHash). Computed by Forme code, not the agent. A fingerprint on the rejected/parked list is dropped before presentation (hard constraint #6).",
      "type": "string",
      "pattern": "^[a-f0-9]{64}$"
    },
    "whyNow": {
      "description": "Card face v0.1 (#12): why this card exists now (出身/时机) — the legibility answer, one plain-language line, rendered as 为什么现在.",
      "type": "string",
      "minLength": 1
    },
    "recommendation": {
      "description": "Card face v0.1 (#12): the agent's declared recommendation — first form of shadow mode. Compared against the actual choice for the W5 consistency metric; never auto-applied.",
      "type": "object",
      "additionalProperties": false,
      "required": ["choice", "reason"],
      "properties": {
        "choice": {
          "description": "The gesture the agent recommends.",
          "type": "string",
          "enum": ["accept", "park", "reject"]
        },
        "reason": {
          "description": "One-line reason for the recommendation.",
          "type": "string",
          "minLength": 1
        }
      }
    },
    "onAccept": {
      "description": "Card face v0.1 (#12): one plain-language line previewing what happens after accept. The deterministic facts (target file, rollback) are appended by the renderer.",
      "type": "string",
      "minLength": 1
    },
    "estSeconds": {
      "description": "Agent's estimate of time-to-decision in seconds. Informational; real latency is measured silently.",
      "type": "integer",
      "minimum": 0
    },
    "stakes": {
      "description": "Card face v0.2 (#21): what accepting this card touches, driving how rich the face must be. 'reversible-ledger' = pure bookkeeping fix, face stays thin; 'real-world-action' = affects things outside the vault, face must open in world-layer terms; 'thought' = a stance/claim conflict, thickest face (#18). Declared by the agent, sanitized by Forme code (invalid/missing → derived from category).",
      "type": "string",
      "enum": ["reversible-ledger", "real-world-action", "thought"]
    },
    "revisedAt": {
      "description": "Card face v0.2 (#21): when Forme last rewrote the face of this card (legibility-gate rewrite or question answer). id/fingerprint/diff never change on a reface. A card with an unanswered question (question event newer than revisedAt) is awaiting context and leaves the decidable queue until refaced.",
      "type": "string",
      "format": "date-time"
    },
    "context": {
      "description": "Card face v0.2 (#21): the question-channel round trip. Set when the card was re-faced in answer to the user's question; rendered as the 你问过 block so the vault mirror stays self-contained.",
      "type": "object",
      "additionalProperties": false,
      "required": ["question", "answer"],
      "properties": {
        "question": {
          "description": "The user's question, verbatim (also recorded as a question event in decisions.jsonl).",
          "type": "string",
          "minLength": 1
        },
        "answer": {
          "description": "The agent's direct one-line answer, in world-layer terms.",
          "type": "string",
          "minLength": 1
        }
      }
    },
    "createdAt": {
      "description": "When Forme wrote this card to disk.",
      "type": "string",
      "format": "date-time"
    }
  },
  "$defs": {
    "evidenceItem": {
      "type": "object",
      "additionalProperties": false,
      "required": ["path"],
      "properties": {
        "path": {
          "description": "Vault-relative path of the evidence source.",
          "type": "string",
          "minLength": 1
        },
        "locator": {
          "description": "Optional pointer within the file, e.g. 'L283', 'frontmatter.status', '#anchor'.",
          "type": "string"
        },
        "quote": {
          "description": "Verbatim excerpt shown as evidence.",
          "type": "string"
        },
        "note": {
          "description": "Agent's one-line reason this is evidence.",
          "type": "string"
        }
      }
    },
    "diff": {
      "type": "object",
      "additionalProperties": false,
      "required": ["file", "hunks"],
      "properties": {
        "file": {
          "description": "Vault-relative path of the file the change targets. Part of the fingerprint.",
          "type": "string",
          "minLength": 1
        },
        "hunks": {
          "type": "array",
          "minItems": 1,
          "items": { "$ref": "#/$defs/hunk" }
        }
      }
    },
    "hunk": {
      "description": "An exact-string replacement: match `before` in the file, replace with `after`. before='' is a pure insertion; after='' is a deletion. `all: true` replaces every occurrence of `before` (#36, repeated-pattern drift). Deterministic to apply and to render as -/+.",
      "type": "object",
      "additionalProperties": false,
      "required": ["before", "after"],
      "properties": {
        "locator": {
          "description": "Optional anchor to disambiguate which occurrence to change, e.g. a line number or field name.",
          "type": "string"
        },
        "before": {
          "description": "Exact text to match. '' means insert.",
          "type": "string"
        },
        "after": {
          "description": "Replacement text. '' means delete.",
          "type": "string"
        },
        "all": {
          "description": "When true, replace every occurrence of `before` (zero occurrences is still a stale-card failure). Absent/false = exactly one occurrence, disambiguated by uniqueness or an L<line> locator.",
          "type": "boolean"
        }
      },
      "anyOf": [
        { "properties": { "before": { "minLength": 1 } } },
        { "properties": { "after": { "minLength": 1 } } }
      ]
    },
    "option": {
      "type": "object",
      "additionalProperties": false,
      "required": ["id", "label", "hotkey"],
      "properties": {
        "id": {
          "description": "Canonical gesture id.",
          "type": "string",
          "enum": ["accept", "park", "reject"]
        },
        "label": {
          "description": "Display label (Chinese by default).",
          "type": "string",
          "minLength": 1
        },
        "hotkey": {
          "description": "Single-key gesture.",
          "type": "string",
          "minLength": 1,
          "maxLength": 1
        }
      }
    }
  }
}
