{
  "schemaVersion": "0",
  "id": "card_c1_meta-work-count_20260704",
  "origin": {
    "agent": "codex",
    "model": "gpt-5-codex",
    "runId": "run_demo_0001",
    "at": "2026-07-04T09:00:00Z"
  },
  "from": "forme://local/runner",
  "role": "proposal",
  "category": "stale-claim",
  "title": "SSOT 里 meta-work 数字停在最旧快照(66)",
  "summary": "三处不一致;最新证据是 78 报告 vs 4 posts(2026-07-01,见 Validation v2 时间序列)。",
  "evidence": [
    {
      "path": "02_Wiki/Projects/Cognitive Continuity System.md",
      "locator": "L283",
      "quote": "66 报告 vs 2 posts",
      "note": "SSOT 停在最旧快照"
    },
    {
      "path": "03_Outputs/Reports/CCS Validation v2 - 2026-07-02.md",
      "locator": "L54",
      "quote": "72:2 → 76:4 → 78:4(2026-07-01)",
      "note": "最新时间序列,报告:输出仍在恶化"
    }
  ],
  "diff": {
    "file": "02_Wiki/Projects/Cognitive Continuity System.md",
    "hunks": [
      {
        "locator": "L283",
        "before": "66 报告 vs 2 posts",
        "after": "78 报告 vs 4 posts(2026-07-01;见 Validation v2 序列)"
      }
    ]
  },
  "options": [
    {
      "id": "accept",
      "label": "接受",
      "hotkey": "a"
    },
    {
      "id": "park",
      "label": "搁置",
      "hotkey": "p"
    },
    {
      "id": "reject",
      "label": "拒绝",
      "hotkey": "r"
    }
  ],
  "fingerprint": "ccd80563bf5d1b46a6c20aa703aa4a0d5be80c3b9439822fd3bafc16d604ce59",
  "stakes": "real-world-action",
  "estSeconds": 15,
  "createdAt": "2026-07-04T09:00:03Z",
  "revisedAt": "2026-07-04T18:20:00Z",
  "context": {
    "question": "这个数字过期了会影响什么?",
    "answer": "对外讲 CCS 验证故事时引用的就是这一行——数字停在最旧快照,下一次引用就是失实。"
  }
}
